<?xml version = "1.0" encoding = "ISO-8859-1" ?>

<domains xmlns              = "http://cl/bee/genfrmjava/domaindef/schema"
         xmlns:xsi          = "http://www.w3.org/2001/XMLSchema-instance"
         xsi:schemaLocation = "http://cl/bee/genfrmjava/domaindef/schema domaindef.xsd">

  <domain name="CODACT" system="TAB" registry="TAB" table="ACT " validation="VALCOD" search="BUSTAB" />
  <domain name="CODAGES" system="TAB" registry="TAB" table="ADG " />
  <domain name="CODBNCA" system="TAB" registry="USR" table="BAC " validation="VALCOD" search="BUSTAB" />
  <domain name="CODCBCO" system="TAB" registry="PZA" table="BCO " validation="VALCOD" search="BUSTAB" />
  <domain name="CODCNEG" system="TAB" registry="USR" table="GCN " validation="VALCOD" search="BUSTAB" />
  <domain name="CODCNL" system="TAB" registry="TAB" table="CNL " validation="VALCOD" search="BUSTAB" />
  <domain name="CODCOMU" system="TAB" table="COM " validation="VALCOD" search="BUSTAB" />
  <domain name="CODCOOC" system="COL" registry="TAB" table="AUX " validation="VALCOD" search="BUSTAB" />
  <domain name="CODCOPD" system="DAP" registry="TAB" table="AUX " validation="VALCOD" search="BUSTAB" />
  <domain name="CODCTAB" system="TAB" table="SVC " validation="VALCOD" />
  <domain name="CODCUSR" system="TAB" table="CUS " validation="VALCOD" search="BUSTAB" />
  <domain name="CODCUST" system="DAP" registry="OPD" table="CUS " validation="VALCOD" search="BUSTAB" />
  <domain name="CODCYA" system="TAB" registry="MSC" table="TCYA" validation="VALIND" search="BUSMSC" />
  <domain name="CODDBHB" system="TAB" registry="TAB" table="IDH " validation="VALCOD" search="BUSTAB" />
  <domain name="CODDEVL" system="GNS" registry="TAB" table="SON " validation="VALCOD" search="BUSTAB" />
  <domain name="CODDPTO" system="TAB" registry="COM" table="DPT " validation="VALCOD" search="BUSTAB" />
  <domain name="CODEJEC" system="TAB" registry="USR" table="USR " validation="VALUSR" search="BUSUSR" />
  <domain name="CODGARA" system="DAP" registry="OPD" table="GAR " validation="VALCOD" search="BUSTAB" />
  <domain name="CODIEPD" system="DAP" registry="TAB" table="CEP " validation="VALCOD" search="BUSTAB" />
  <domain name="CODMORE" system="DAP" registry="DAP" table="MDR " validation="VALCOD" search="BUSTAB" />
  <domain name="CODMVTO" system="DAP" registry="TAB" table="MVT " validation="VALCOD" search="BUSTAB" />
  <domain name="CODOFIC" system="TAB" registry="OFI" table="OFI " validation="VALOFI" search="BUSOFI" />
  <domain name="CODPAIS" system="TAB" registry="COM" table="PAI " validation="VALCOD" search="BUSTAB" />
  <domain name="CODPLAT" system="TAB" registry="USR" table="PLT " validation="VALCOD" search="BUSTAB" />
  <domain name="CODPLZA" system="TAB" registry="OFI" table="PZA " validation="VALCOD" search="BUSTAB" />
  <domain name="CODPLZO" system="TAB" registry="TAB" table="PZO " validation="VALCOD" search="BUSTAB" />
  <domain name="CODPRVC" system="TAB" registry="COM" table="PRV " validation="VALCOD" search="BUSTAB" />
  <domain name="CODPTR" system="TAB" registry="TAB" table="PTR " validation="VALCOD" search="BUSTAB" />
  <domain name="CODREGI" system="TAB" registry="COM" table="REG " validation="VALCOD" search="BUSTAB" />
  <domain name="CODREGL" system="TAB" registry="USR" table="RGN " validation="VALCOD" search="BUSTAB" />
  <domain name="CODSEPD" system="DAP" registry="TAB" table="SEP " validation="VALCOD" search="BUSTAB" />
  <domain name="CODSTT" system="GNS" registry="TAB" table="STT " validation="VALCOD" search="BUSTAB" />
  <domain name="CODTALG" system="DAP" registry="TAB" table="ALG " validation="VALCOD" search="BUSTAB" />
  <domain name="CODTCCT" system="TAB" registry="TAB" table="TCC " validation="VALCOD" search="BUSTAB" />
  <domain name="CODTDU" system="TAB" registry="USR" table="EJC " validation="VALTDU" search="BUSUSR" />
  <domain name="CODTEJE" system="TAB" registry="USR" table="CEP " />
  <domain name="CODTOPD" system="TAB" registry="TAB" table="TIO " validation="VALCOD" search="BUSTAB" />
  <domain name="CODTTA1" system="TAB" table="IVB " validation="VALCOD" search="BUSTAB" />
  <domain name="CODTTAB" system="TAB" table="USR " validation="VALCOD" search="BUSTAB" />
  <domain name="CODUBIC" system="TAB" table="UBI " validation="VALCOD" search="BUSTAB" />
  <domain name="CODVCAM" system="TAB" registry="TAB" table="VLR " validation="VALCOD" search="BUSTAB" />
  <domain name="CODVCOC" system="TAB" registry="TAB" table="VLR " validation="VALCOD" search="BUSTAB" />
  <domain name="CODVIGE" system="GNS" registry="TAB" table="SON " validation="VALCOD" search="BUSTAB" />
  <domain name="INDACPA" system="TAB" registry="MSC" table="ACPA" validation="VALIND" search="BUSMSC" />
  <domain name="INDDURV" system="TAB" registry="MSC" table="IPER" validation="VALIND" search="BUSMSC" />
  <domain name="INDLOGA" system="GNS" registry="TAB" table="SON " validation="VALCOD" search="BUSTAB" />
  <domain name="INDRETD" system="TAB" registry="MSC" table="IPER" validation="VALIND" search="BUSMSC" />
  <domain name="INDSEVE" system="TAB" registry="MSC" table="IPER" validation="VALIND" search="BUSMSC" />
  <domain name="INDTCAD" system="TAB" registry="MSC" table="TCYA" />
  <domain name="INDTCOL" system="COL" registry="MSC" table="TCOL" validation="VALIND" search="BUSMSC" />
  <domain name="INDVIGE" system="GNS" registry="TAB" table="SON " validation="VALCOD" search="BUSTAB" />
  <domain name="TABCAP" system="TAB" table="CAP " validation="VALCOD" search="BUSTAB" />
  <domain name="TABFOR" system="TAB" table="FOR " validation="VALCOD" search="BUSTAB" />
</domains>
