<?xml version = "1.0" encoding = "ISO-8859-1" ?>

<domains xmlns              = "http://cl/bee/genfrmjava/domaindef/schema"
         xmlns:xsi          = "http://www.w3.org/2001/XMLSchema-instance"
         xsi:schemaLocation = "http://cl/bee/genfrmjava/domaindef/schema domaindef.xsd">

  <domain name="CODACCI" system="GNS" table="AOC " validation="VALCOD" search="BUSTAB" />
  <domain name="CODAMPA" system="GNS" registry="TAB" table="AMP " validation="VALCOD" search="BUSTAB" />
  <domain name="CODASCR" system="GNS" registry="TAB" table="ASC " validation="VALCOD" search="BUSTAB" />
  <domain name="CODBANC" system="TAB" table="BCO " />
  <domain name="CODBNCO" system="GNS" table="BCO " validation="VALCOD" search="BUSTAB" />
  <domain name="CODCAMB" system="GNS" table="BDC " validation="VALCOD" search="BUSTAB" />
  <domain name="CODCART" system="GNS" table="CRT " validation="VALCOD" search="BUSTAB" />
  <domain name="CODCDGO" system="GNS" registry="REG" table="222 " />
  <domain name="CODCFNC" system="GNS" table="FDC " validation="VALCOD" search="BUSTAB" />
  <domain name="CODCMND" system="GNS" table="CMN " validation="VALCOD" search="BUSTAB" />
  <domain name="CODCNAL" system="GNS" table="CNL " />
  <domain name="CODCONS" system="GNS" table="SON " validation="VALCOD" search="BUSTAB" />
  <domain name="CODCVDT" system="GNS" table="VDT " validation="VALCOD" search="BUSTAB" />
  <domain name="CODFST1" system="GNS" table="TDP " validation="VALCOD" search="BUSTAB" />
  <domain name="CODGRPO" system="GNS" table="GRP " validation="VALCOD" search="BUSTAB" />
  <domain name="CODINST" system="GNS" registry="TAB" table="IST " validation="VALCOD" search="BUSTAB" />
  <domain name="CODLCLX" system="GNS" registry="TAB" table="CLX " validation="VALCOD" search="BUSTAB" />
  <domain name="CODLGMG" system="GNS" registry="TAB" table="LMG " validation="VALCOD" search="BUSTAB" />
  <domain name="CODLGMM" system="GNS" registry="TAB" table="LMM " validation="VALCOD" search="BUSTAB" />
  <domain name="CODLGMV" system="GNS" registry="TAB" table="LMV " validation="VALCOD" search="BUSTAB" />
  <domain name="CODLSLX" system="GNS" registry="TAB" table="SLX " validation="VALCOD" search="BUSTAB" />
  <domain name="CODMODO" system="GNS" registry="TAB" table="MDO " validation="VALCOD" search="BUSTAB" />
  <domain name="CODMRCA" system="GNS" table="MRC " validation="VALCOD" search="BUSTAB" />
  <domain name="CODMSAL" system="GNS" registry="TAB" table="MSL " validation="VALCOD" />
  <domain name="CODOFIA" system="TAB" table="OFI " />
  <domain name="CODOFIC" system="TAB" registry="OFI" table="OFI " />
  <domain name="CODPAMB" system="GNS" table="BDC " validation="VALCOD" search="BUSTAB" />
  <domain name="CODPENT" system="GNS" table="EDC " validation="VALCOD" search="BUSTAB" />
  <domain name="CODPFNC" system="GNS" table="FDC " validation="VALCOD" search="BUSTAB" />
  <domain name="CODPMOD" system="GNS" table="MDC " validation="VALCOD" search="BUSTAB" />
  <domain name="CODPRUE" system="STM" table="TBL " />
  <domain name="CODPUSR" system="GNS" table="UDC " validation="VALCOD" search="BUSTAB" />
  <domain name="CODPVDT" system="GNS" table="VDT " validation="VALCOD" search="BUSTAB" />
  <domain name="CODSIST" system="GNS" table="SIS " validation="VALCOD" search="BUSTAB" />
  <domain name="CODSSDS" system="GNS" table="SDS " />
  <domain name="CODTCTL" system="GNS" registry="TAB" table="TCT " />
  <domain name="CODTDPU" system="GNS" table="TDP " validation="VALCOD" search="BUSTAB" />
  <domain name="CODTENT" system="GNS" registry="TAB" table="TEN " validation="VALCOD" search="BUSTAB" />
  <domain name="CODTFUN" system="GNS" registry="TAB" table="TFN " validation="VALCOD" search="BUSTAB" />
  <domain name="CODTINF" system="GNS" registry="TAB" table="TIN " />
  <domain name="CODUCVT" system="GNS" table="UDC " validation="VALCOD" search="BUSTAB" />
  <domain name="CODUIDD" system="GNS" table="UIM " validation="VALCOD" />
  <domain name="CODUSER" system="TAB" table="USR " validation="VALUSR" search="BUSUSR" />
  <domain name="CODUSUA" system="TAB" table="USR " validation="VALUSR" search="BUSUSR" />
  <domain name="CODVIGE" system="GNS" table="SON " validation="VALCOD" search="BUSTAB" />
  <domain name="CUDUSER" system="TAB" registry="USR" table="USR " validation="VALUSER" search="BUSUSR" />
  <domain name="GLSMODO" system="GNS" registry="TAB" table="MRL " validation="VALCOD" search="BUSTAB" />
  <domain name="GLSTPRO" system="GNS" registry="TAB" table="TPR " validation="VALCOD" search="BUSTAB" />
  <domain name="GNSMUL" system="   " table="    " validation="PARRAFO-VAL" search="PARRAFO-BUSQ" />
  <domain name="IDDGRPO" system="GNS" registry="TAB" table="GID " />
  <domain name="IDDTENT" system="GNS" registry="TAB" table="TID " />
  <domain name="INDECIC" system="SGC" table="SEXO" />
  <domain name="INDECIV" system="SGC" table="ECIV" />
  <domain name="INDINDI" system="GNS" table="111 " validation="VALCOD" search="NO" />
  <domain name="INDIPRV" system="GNS" registry="TAB" table="IPV " validation="VALCOD" search="BUSTAB" />
  <domain name="INDRESP" system="GNS" table="SON " validation="VALCOD" search="BUSTAB" />
  <domain name="INDSINO" system="GNS" registry="TAB" table="SON " validation="VALCOD" search="BUSTAB" />
  <domain name="INDVIGE" system="GNS" table="SON " />
  <domain name="ITKCRESP" system="GNS" table="SRT " validation="VALCOD" search="BUSTAB" />
  <domain name="ITKIRESP" system="GNS" table="IRT " validation="VALCOD" search="BUSTAB" />
  <domain name="MSCMSCL" system="GNS" table="333 " />
  <domain name="MSCSEXC" system="SGC" table="SEXO" />
  <domain name="MSCSEXO" system="SGC" registry="XXX" table="SEXO" />
  <domain name="MSCSTAT" system="GNS" table="SON " validation="VALCOD" search="BUSTAB" />
  <domain name="MSCVIGE" system="GNS" registry="MSC" table="VIGE" />
  <domain name="PANCLRP" system="GNS" registry="TAB" table="ILP " />
  <domain name="PANCLRV" system="GNS" registry="TAB" table="ILV " />
  <domain name="PANTCLA" system="GNS" registry="TAB" table="TCP " />
  <domain name="PANTFUN" system="GNS" registry="TAB" table="TFP " />
  <domain name="PCKSTAT" system="GNS" table="SPK " validation="VALCOD" search="BUSTAB" />
  <domain name="RF1CMND" system="GNS" registry="RF1" table="RFP " validation="VALCOD" search="BUSTAB" />
  <domain name="XXXCDGO" system="GNS" table="444 " />
</domains>
